Release 11.2.0.1.0 Production on Thu Sep 11 09:23:49 2025

Copyright (c) 1982, 2010, Oracle.  All rights reserved.

Enter user-name: scott
Enter password:
ERROR:
ORA-01017: invalid username/password; logon denied


Enter user-name: scott
Enter password:

Connected to:
Oracle Database 11g Enterprise Edition Release 11.2.0.1.0 - Production
With the Partitioning, OLAP, Data Mining and Real Application Testing options

SQL> set lines 100 pages 100
SQL> select * from emp;

     EMPNO ENAME      JOB              MGR HIREDATE         SAL       COMM     DEPTNO
---------- ---------- --------- ---------- --------- ---------- ---------- ----------
      7369 SMITH      CLERK           7902 17-DEC-80        800                    20
      7499 ALLEN      SALESMAN        7698 20-FEB-81       1600        300         30
      7521 WARD       SALESMAN        7698 22-FEB-81       1250        500         30
      7566 JONES      MANAGER         7839 02-APR-81       2975                    20
      7654 MARTIN     SALESMAN        7698 28-SEP-81       1250       1400         30
      7698 BLAKE      MANAGER         7839 01-MAY-81       2850                    30
      7782 CLARK      MANAGER         7839 09-JUN-81       2450                    10
      7788 SCOTT      ANALYST         7566 19-APR-87       3000                    20
      7839 KING       PRESIDENT            17-NOV-81       5000                    10
      7844 TURNER     SALESMAN        7698 08-SEP-81       1500          0         30
      7876 ADAMS      CLERK           7788 23-MAY-87       1100                    20
      7900 JAMES      CLERK           7698 03-DEC-81        950                    30
      7902 FORD       ANALYST         7566 03-DEC-81       3000                    20
      7934 MILLER     CLERK           7782 23-JAN-82       1300                    10

14 rows selected.

SQL> update emp set sal=sal*2 where job='MANAGER';

3 rows updated.

SQL> select * from emp;

     EMPNO ENAME      JOB              MGR HIREDATE         SAL       COMM     DEPTNO
---------- ---------- --------- ---------- --------- ---------- ---------- ----------
      7369 SMITH      CLERK           7902 17-DEC-80        800                    20
      7499 ALLEN      SALESMAN        7698 20-FEB-81       1600        300         30
      7521 WARD       SALESMAN        7698 22-FEB-81       1250        500         30
      7566 JONES      MANAGER         7839 02-APR-81       5950                    20
      7654 MARTIN     SALESMAN        7698 28-SEP-81       1250       1400         30
      7698 BLAKE      MANAGER         7839 01-MAY-81       5700                    30
      7782 CLARK      MANAGER         7839 09-JUN-81       4900                    10
      7788 SCOTT      ANALYST         7566 19-APR-87       3000                    20
      7839 KING       PRESIDENT            17-NOV-81       5000                    10
      7844 TURNER     SALESMAN        7698 08-SEP-81       1500          0         30
      7876 ADAMS      CLERK           7788 23-MAY-87       1100                    20
      7900 JAMES      CLERK           7698 03-DEC-81        950                    30
      7902 FORD       ANALYST         7566 03-DEC-81       3000                    20
      7934 MILLER     CLERK           7782 23-JAN-82       1300                    10

14 rows selected.

SQL> update emp set ename='SMIITH' WHERE ENAME='SMITH';

1 row updated.

SQL> select * from emp;

     EMPNO ENAME      JOB              MGR HIREDATE         SAL       COMM     DEPTNO
---------- ---------- --------- ---------- --------- ---------- ---------- ----------
      7369 SMIITH     CLERK           7902 17-DEC-80        800                    20
      7499 ALLEN      SALESMAN        7698 20-FEB-81       1600        300         30
      7521 WARD       SALESMAN        7698 22-FEB-81       1250        500         30
      7566 JONES      MANAGER         7839 02-APR-81       5950                    20
      7654 MARTIN     SALESMAN        7698 28-SEP-81       1250       1400         30
      7698 BLAKE      MANAGER         7839 01-MAY-81       5700                    30
      7782 CLARK      MANAGER         7839 09-JUN-81       4900                    10
      7788 SCOTT      ANALYST         7566 19-APR-87       3000                    20
      7839 KING       PRESIDENT            17-NOV-81       5000                    10
      7844 TURNER     SALESMAN        7698 08-SEP-81       1500          0         30
      7876 ADAMS      CLERK           7788 23-MAY-87       1100                    20
      7900 JAMES      CLERK           7698 03-DEC-81        950                    30
      7902 FORD       ANALYST         7566 03-DEC-81       3000                    20
      7934 MILLER     CLERK           7782 23-JAN-82       1300                    10

14 rows selected.

SQL> update emp set job='PRESIDENT' where ename=KING';
ERROR:
ORA-01756: quoted string not properly terminated


SQL> update emp set job='PRESIDENT' where ename='KING';

1 row updated.

SQL> select * from emp;

     EMPNO ENAME      JOB              MGR HIREDATE         SAL       COMM     DEPTNO
---------- ---------- --------- ---------- --------- ---------- ---------- ----------
      7369 SMIITH     CLERK           7902 17-DEC-80        800                    20
      7499 ALLEN      SALESMAN        7698 20-FEB-81       1600        300         30
      7521 WARD       SALESMAN        7698 22-FEB-81       1250        500         30
      7566 JONES      MANAGER         7839 02-APR-81       5950                    20
      7654 MARTIN     SALESMAN        7698 28-SEP-81       1250       1400         30
      7698 BLAKE      MANAGER         7839 01-MAY-81       5700                    30
      7782 CLARK      MANAGER         7839 09-JUN-81       4900                    10
      7788 SCOTT      ANALYST         7566 19-APR-87       3000                    20
      7839 KING       PRESIDENT            17-NOV-81       5000                    10
      7844 TURNER     SALESMAN        7698 08-SEP-81       1500          0         30
      7876 ADAMS      CLERK           7788 23-MAY-87       1100                    20
      7900 JAMES      CLERK           7698 03-DEC-81        950                    30
      7902 FORD       ANALYST         7566 03-DEC-81       3000                    20
      7934 MILLER     CLERK           7782 23-JAN-82       1300                    10

14 rows selected.

SQL> update emp set ename='ALLEN MORGAN' WHERE ENAME='ALLEN';
update emp set ename='ALLEN MORGAN' WHERE ENAME='ALLEN'
                     *
ERROR at line 1:
ORA-12899: value too large for column "SCOTT"."EMP"."ENAME" (actual: 12, maximum: 10)


SQL> update emp set ename='ALLENMORGAN' WHERE ENAME='ALLEN';
update emp set ename='ALLENMORGAN' WHERE ENAME='ALLEN'
                     *
ERROR at line 1:
ORA-12899: value too large for column "SCOTT"."EMP"."ENAME" (actual: 11, maximum: 10)


SQL> update emp set ename='ALLE MORGAN' WHERE ENAME='ALLEN';
update emp set ename='ALLE MORGAN' WHERE ENAME='ALLEN'
                     *
ERROR at line 1:
ORA-12899: value too large for column "SCOTT"."EMP"."ENAME" (actual: 11, maximum: 10)


SQL> update emp set ename='MORGAN' WHERE ENAME='ALLEN';

1 row updated.

SQL> select * from emp;

     EMPNO ENAME      JOB              MGR HIREDATE         SAL       COMM     DEPTNO
---------- ---------- --------- ---------- --------- ---------- ---------- ----------
      7369 SMIITH     CLERK           7902 17-DEC-80        800                    20
      7499 MORGAN     SALESMAN        7698 20-FEB-81       1600        300         30
      7521 WARD       SALESMAN        7698 22-FEB-81       1250        500         30
      7566 JONES      MANAGER         7839 02-APR-81       5950                    20
      7654 MARTIN     SALESMAN        7698 28-SEP-81       1250       1400         30
      7698 BLAKE      MANAGER         7839 01-MAY-81       5700                    30
      7782 CLARK      MANAGER         7839 09-JUN-81       4900                    10
      7788 SCOTT      ANALYST         7566 19-APR-87       3000                    20
      7839 KING       PRESIDENT            17-NOV-81       5000                    10
      7844 TURNER     SALESMAN        7698 08-SEP-81       1500          0         30
      7876 ADAMS      CLERK           7788 23-MAY-87       1100                    20
      7900 JAMES      CLERK           7698 03-DEC-81        950                    30
      7902 FORD       ANALYST         7566 03-DEC-81       3000                    20
      7934 MILLER     CLERK           7782 23-JAN-82       1300                    10

14 rows selected.

SQL> update emp set sal=sal+sal*10/100 where sal < 2000 and job='SALESMAN';

4 rows updated.

SQL> select * from emp;

     EMPNO ENAME      JOB              MGR HIREDATE         SAL       COMM     DEPTNO
---------- ---------- --------- ---------- --------- ---------- ---------- ----------
      7369 SMIITH     CLERK           7902 17-DEC-80        800                    20
      7499 MORGAN     SALESMAN        7698 20-FEB-81       1760        300         30
      7521 WARD       SALESMAN        7698 22-FEB-81       1375        500         30
      7566 JONES      MANAGER         7839 02-APR-81       5950                    20
      7654 MARTIN     SALESMAN        7698 28-SEP-81       1375       1400         30
      7698 BLAKE      MANAGER         7839 01-MAY-81       5700                    30
      7782 CLARK      MANAGER         7839 09-JUN-81       4900                    10
      7788 SCOTT      ANALYST         7566 19-APR-87       3000                    20
      7839 KING       PRESIDENT            17-NOV-81       5000                    10
      7844 TURNER     SALESMAN        7698 08-SEP-81       1650          0         30
      7876 ADAMS      CLERK           7788 23-MAY-87       1100                    20
      7900 JAMES      CLERK           7698 03-DEC-81        950                    30
      7902 FORD       ANALYST         7566 03-DEC-81       3000                    20
      7934 MILLER     CLERK           7782 23-JAN-82       1300                    10

14 rows selected.

SQL> delete * from emp where comm is null;
delete * from emp where comm is null
       *
ERROR at line 1:
ORA-00903: invalid table name


SQL> delete from emp where comm is null;

10 rows deleted.

SQL> select * from emp;

     EMPNO ENAME      JOB              MGR HIREDATE         SAL       COMM     DEPTNO
---------- ---------- --------- ---------- --------- ---------- ---------- ----------
      7499 MORGAN     SALESMAN        7698 20-FEB-81       1760        300         30
      7521 WARD       SALESMAN        7698 22-FEB-81       1375        500         30
      7654 MARTIN     SALESMAN        7698 28-SEP-81       1375       1400         30
      7844 TURNER     SALESMAN        7698 08-SEP-81       1650          0         30

SQL> delete from emp where hiredate<'31-DEC-1987' and deptno=20;

0 rows deleted.

SQL> select * from emp;

     EMPNO ENAME      JOB              MGR HIREDATE         SAL       COMM     DEPTNO
---------- ---------- --------- ---------- --------- ---------- ---------- ----------
      7499 MORGAN     SALESMAN        7698 20-FEB-81       1760        300         30
      7521 WARD       SALESMAN        7698 22-FEB-81       1375        500         30
      7654 MARTIN     SALESMAN        7698 28-SEP-81       1375       1400         30
      7844 TURNER     SALESMAN        7698 08-SEP-81       1650          0         30

SQL>